{
  "$schema": "../schema/avatar.schema.json",
  "schema_version": "0.1",
  "name": "Diva d'esempio",
  "identity": {
    "presentation": 0.9,
    "apparent_age": 28,
    "lineage_preference": ["elf", "human"]
  },
  "body": {
    "height": 0.6,
    "weight": 0.4,
    "build": {"lean": 0.5, "muscular": 0.4, "heavy": 0.1}
  },
  "skin": {
    "color": "#d9a98c",
    "undertone": "warm",
    "freckles": 0.6,
    "beauty_marks": true,
    "dark_circles": 0.1
  },
  "face": {
    "shape": "heart",
    "face_length": 0.5,
    "forehead_height": 0.45,
    "brow_height": 0.55,
    "brow_thickness": 0.35,
    "lash_length": 0.6,
    "eye_size": 0.7,
    "eye_spacing": 0.55,
    "eye_tilt": 0.65,
    "nose_width": 0.3,
    "nose_length": 0.4,
    "nose_bridge": 0.5,
    "cheekbone_prominence": 0.75,
    "cheek_fullness": 0.35,
    "lip_fullness": 0.65,
    "mouth_width": 0.45,
    "jaw_width": 0.3,
    "chin_prominence": 0.4,
    "ear_size": 0.5
  },
  "eyes": {"color": "#3f7f5f"},
  "brows": {"color": "#5a2e1b"},
  "hair": {
    "length": "long",
    "texture": "wavy",
    "style_tags": ["ponytail", "side_part"],
    "bangs": false,
    "color": "#8b3a1e",
    "highlight_color": "#c46a32"
  },
  "facial_hair": {"style": "none"},
  "makeup": {"eyeliner": 0.4, "blush": 0.2, "lip_color": "#a8424a"},
  "voice": {"pitch": 0.7},
  "marks": [
    {"type": "scar", "area": "sopracciglio sinistro", "description": "piccola cicatrice verticale"},
    {"type": "tattoo", "area": "avambraccio destro", "description": "fasce geometriche sottili"}
  ],
  "accessories": [
    {"type": "earrings", "description": "piccoli cerchi d'argento"}
  ],
  "notes": "Sguardo deciso, aria da esploratrice."
}
